Project Name,URL,Language,Forks,Watchers,Size Byte,Stars,Topics,Contributors,Type
mongodb/mongo,https://github.com/mongodb/mongo,C++,5130,21272,706246,21272,"c-plus-plus, database, mongodb, nosql",890,Other
n8n-io/n8n,https://github.com/n8n-io/n8n,TypeScript,2300,21250,32793,21250,"apis, automated, automation, cli, data-flow, development, docker, iaas, integration-framework, integrations, ipaas, low-code, low-code-development-platform, low-code-plattform, n8n, node, self-hosted, typescript, workflow, workflow-automation",198,"Framework, Web Application"
helm/helm,https://github.com/helm/helm,Go,6071,21241,18343,21241,"chart, charts, cncf, helm, kubernetes",660,Other
mbadolato/iTerm2-Color-Schemes,https://github.com/mbadolato/iTerm2-Color-Schemes,Shell,6060,21207,95187,21207,"color-scheme, freebsd-vt, iterm, iterm2, konsole, konsole-color-schemes, lxterminal, osx-terminal-themes, putty, putty-color-schemes, schemes, terminal, terminal-schemes, terminal-themes, terminator, theme, themes, windows-terminal, xrdb, xresources",177,Other
fabricjs/fabric.js,https://github.com/fabricjs/fabric.js,JavaScript,3001,21206,129542,21206,,284,Other
halo-dev/halo,https://github.com/halo-dev/halo,Java,7237,21191,38246,21191,"blog, blog-engine, cms, hacktoberfest, halo, halocms",86,Other
openfaas/faas,https://github.com/openfaas/faas,Go,1733,21178,27270,21178,"docker, faas, functions, functions-as-a-service, gitops, golang, k8s, kubernetes, lambda, nodejs, paas, prometheus, serverless, serverless-functions",175,Other
mochajs/mocha,https://github.com/mochajs/mocha,JavaScript,2930,21172,19650,21172,"bdd, browser, javascript, mocha, mochajs, node, nodejs, tdd, test, test-framework, testing, testing-tools",526,"Framework, Web Application"
SwiftyJSON/SwiftyJSON,https://github.com/SwiftyJSON/SwiftyJSON,Swift,3300,21171,1112,21171,"carthage, cocoapods, json, json-parser, json-parsing-library, json-parsing-swift, request, response, swift, swift4-2, swiftyjson, xcode10",149,Other
google/iosched,https://github.com/google/iosched,Kotlin,6230,21168,57737,21168,"android, architecture, conference, coroutines, kotlin",76,Mobile App
kriasoft/react-starter-kit,https://github.com/kriasoft/react-starter-kit,TypeScript,4101,21130,8782,21130,"babel, boilerplate, cdn, cloudflare, graphql, hackathon, javascript, material-ui, nodejs, react, reactjs, relay, scaffolding, serverless, ssr, starter-kit, template, typescript, webpack, webpack5",,Web Application
bevacqua/dragula,https://github.com/bevacqua/dragula,JavaScript,1966,21099,1942,21099,"component, drag-and-drop, drag-drop, dragging, front-end, javascript, vanilla",41,Other
usablica/intro.js,https://github.com/usablica/intro.js,JavaScript,2590,21036,24496,21036,"cdn, guide, html, introjs, javascript, minify, tour, ux",113,Web Application
prisma/prisma,https://github.com/prisma/prisma,TypeScript,743,21017,47836,21017,"database, javascript, mariadb, mongo, mongodb, mongodb-orm, mssql, mysql, nodejs, orm, postgres, postgresql, prisma, prisma-client, sql-server, sqlite, sqlserver, typescript",154,Other
portainer/portainer,https://github.com/portainer/portainer,JavaScript,1896,21001,61781,21001,"docker, docker-compose, docker-container, docker-deployment, docker-image, docker-swarm, docker-ui, dockerfile, hacktoberfest, kubernetes, moby, portainer, ui",227,Other
files-community/Files,https://github.com/files-community/Files,C#,1167,20990,123533,20990,"alternatives, csharp, developer-tools, dotnet, file-manager, files, fluent, fluent-design, good-first-issue, mica, power-user, productivity, utilities, uwp, windows, windows-10, windows-11, winui, xaml",204,Other
nsqio/nsq,https://github.com/nsqio/nsq,Go,2687,20981,13777,20981,"distributed-systems, go, message-queue, messaging, nsq, queue",127,Other
NativeScript/NativeScript,https://github.com/NativeScript/NativeScript,TypeScript,1563,20955,60187,20955,"android, angular, capacitor, cross-platform, ionic, ios, java, javascript, kotlin, nativescript, objective-c, react, svelte, swift, typescript, vue",246,"Mobile App, Web Application"
komeiji-satori/Dress,https://github.com/komeiji-satori/Dress,Standard ML,4274,20944,2103914,20944,,370,Other
kilimchoi/engineering-blogs,https://github.com/kilimchoi/engineering-blogs,Ruby,586,20932,1405,20932,"engineering-blogs, lists, programming-blogs, software-development, tech",369,Other
react-navigation/react-navigation,https://github.com/react-navigation/react-navigation,TypeScript,4551,20916,44900,20916,"hacktoberfest, navigation, react, react-native, react-navigation",138,Web Application
eriklindernoren/ML-From-Scratch,https://github.com/eriklindernoren/ML-From-Scratch,Python,4108,20854,553,20854,"data-mining, data-science, deep-learning, deep-reinforcement-learning, genetic-algorithm, machine-learning, machine-learning-from-scratch",9,AI
bilibili/flv.js,https://github.com/bilibili/flv.js,JavaScript,3251,20847,1511,20847,,16,Other
paularmstrong/normalizr,https://github.com/paularmstrong/normalizr,JavaScript,852,20845,2953,20845,"api, flux, javascript, json, normalize, normalizr, reactjs, redux",66,Web Application
sharkdp/fd,https://github.com/sharkdp/fd,Rust,548,20811,1335,20811,"cli, command-line, filesystem, hacktoberfest, regex, rust, search, terminal, tool",143,Other
swc-project/swc,https://github.com/swc-project/swc,Rust,645,20805,89672,20805,"babel, compiler, ecmascript, ecmascript-parser, javascript, parser, rust, swc, typescript, typescript-compiler, typescript-parser",146,Other
xuxueli/xxl-job,https://github.com/xuxueli/xxl-job,Java,8833,20787,32498,20787,"distributed, glue, java, job, quartz, restful, schedule, scheduler, task, xxl-job",81,Other
zsh-users/zsh-autosuggestions,https://github.com/zsh-users/zsh-autosuggestions,Shell,1325,20747,573,20747,"autocomplete, autosuggest, fish, shell, zsh, zsh-autosuggestions",48,Other
conwnet/github1s,https://github.com/conwnet/github1s,JavaScript,704,20691,14270,20691,hacktoberfest,37,Other
HeroTransitions/Hero,https://github.com/HeroTransitions/Hero,Swift,1674,20677,30805,20677,"animation, animations, carthage, custom-transitions, hero, ios, ios-animation, ios-framework, ios-lib, ios-swift, ios-transition, material-design, swift, swiftpm, transition-animation, xcode",78,"Framework, Mobile App, Web Application"
chenglou/react-motion,https://github.com/chenglou/react-motion,JavaScript,1167,20657,5015,20657,,72,Other
google/gson,https://github.com/google/gson,Java,3995,20634,11201,20634,,128,Other
getredash/redash,https://github.com/getredash/redash,Python,3619,20634,26717,20634,"analytics, athena, bi, bigquery, business-intelligence, dashboard, databricks, hacktoberfest, javascript, mysql, postgresql, python, redash, redshift, spark, spark-sql, visualization",408,Other
pugjs/pug,https://github.com/pugjs/pug,JavaScript,1970,20625,14862,20625,,250,Other
quasarframework/quasar,https://github.com/quasarframework/quasar,JavaScript,2651,20598,125462,20598,"android, browser-extension, electron, ios, javascript, material, material-components, material-design, material-theme, pwa, quasar-framework, server-side-rendering, ssr, vue, vue-component, vue-components, vue3, vuejs, vuejs3",525,"Framework, Mobile App, Web Application"
react-bootstrap/react-bootstrap,https://github.com/react-bootstrap/react-bootstrap,TypeScript,3292,20494,29862,20494,"bootstrap, hacktoberfest, javascript, react, react-components, typescript",469,Web Application
wangzheng0822/algo,https://github.com/wangzheng0822/algo,Python,6593,20477,1173,20477,,142,Other
keon/algorithms,https://github.com/keon/algorithms,Python,4222,20457,1377,20457,"algorithm, algorithms, competitive-programming, data-structure, graph, python, search, sort, tree",182,Other
jlmakes/scrollreveal,https://github.com/jlmakes/scrollreveal,JavaScript,2181,20457,1114,20457,"animation, css, javascript, reveal, scroll, scrollreveal, transform, transition",15,Web Application
ColorlibHQ/gentelella,https://github.com/ColorlibHQ/gentelella,HTML,6844,20454,35068,20454,"admin-dashboard, bootstrap, colorlib, dashboard, html, html-template",71,Web Application
tornadoweb/tornado,https://github.com/tornadoweb/tornado,Python,5425,20420,9413,20420,"asynchronous, python",422,Other
SwiftGGTeam/the-swift-programming-language-in-chinese,https://github.com/SwiftGGTeam/the-swift-programming-language-in-chinese,CSS,5154,20416,39531,20416,hacktoberfest,261,Other
Meituan-Dianping/mpvue,https://github.com/Meituan-Dianping/mpvue,JavaScript,2118,20381,8393,20381,"mini, mpvue, vue, weapp, wxmp",146,Web Application
ehang-io/nps,https://github.com/ehang-io/nps,Go,3694,20379,9189,20379,"dns, firewall, go, gzip, http, https, nat, nps, snnapy, socks, socks5, ssh, tcp, tunnel, udp",35,Other
DesignPatternsPHP/DesignPatternsPHP,https://github.com/DesignPatternsPHP/DesignPatternsPHP,PHP,4361,20343,6095,20343,"code-examples, design-pattern, design-patterns, designpatternsphp, hacktoberfest, modern-php, oop, php, php8, phpunit",202,Other
yt-dlp/yt-dlp,https://github.com/yt-dlp/yt-dlp,Python,1481,20323,32886,20323,"python, sponskrub, sponsorblock, video-downloader, youtube-dl, youtube-dlc, yt-dlp",1099,Other
julycoding/The-Art-Of-Programming-By-July,https://github.com/julycoding/The-Art-Of-Programming-By-July,C,7150,20266,27558,20266,,115,Other
dnSpy/dnSpy,https://github.com/dnSpy/dnSpy,C#,3905,20234,35047,20234,,29,Other
ApolloAuto/apollo,https://github.com/ApolloAuto/apollo,C++,8192,20229,2589366,20229,"apollo, autonomous-driving, autonomous-vehicles, autonomy, self-driving-car",370,Other
haizlin/fe-interview,https://github.com/haizlin/fe-interview,JavaScript,2811,20215,7175,20215,"css, fe-interview, front-end, frontend, frontend-interview, html, interview, interview-questions, javascript, js, node, nodejs, react, resume, vue",9,Web Application
StevenBlack/hosts,https://github.com/StevenBlack/hosts,Python,1783,20181,364904,20181,"ad-blocker, anti-virus, curated-sources, gambling-filter, hosts, malware, porn-filter, pornblocker, privacy, protection, python, ransomware, security, social-media-filter, trojans, unified-hosts",127,Other
postcss/autoprefixer,https://github.com/postcss/autoprefixer,JavaScript,1246,20168,7869,20168,"css, postcss-plugins, prefixer",195,Web Application
git-tips/tips,https://github.com/git-tips/tips,JavaScript,1711,20152,483,20152,"git, tips, tips-and-tricks",80,Other
localForage/localForage,https://github.com/localForage/localForage,JavaScript,1179,20138,4861,20138,"indexeddb, javascript, localforage, localstorage, offline, storage, websql",111,Web Application
coolsnowwolf/lede,https://github.com/coolsnowwolf/lede,C,16504,20126,274389,20126,"lede, lua, openwrt, openwrt-feed, openwrt-package, openwrt-shadowsocksr-libev-full, openwrt-zh-cn",325,Other
eslint/eslint,https://github.com/eslint/eslint,JavaScript,3602,20120,29903,20120,"ecmascript, eslint, javascript, linter, static-code-analysis",971,Other
nefe/You-Dont-Need-jQuery,https://github.com/nefe/You-Dont-Need-jQuery,JavaScript,1825,20092,707,20092,,101,Other
floating-ui/floating-ui,https://github.com/floating-ui/floating-ui,TypeScript,1298,20080,15176,20080,"dropdown, hacktoberfest, popover, popovers, position, positioning, positioning-engine, tooltip, tooltip-position",46,Other
yeasy/docker_practice,https://github.com/yeasy/docker_practice,Go,5216,20056,11849,20056,"book, cloud-computing, container, devops, docker, kubernetes, linux, mesos, spark, swarm",109,Other
nicolargo/glances,https://github.com/nicolargo/glances,Python,1278,20043,38773,20043,"monitoring, multi-platform, python, restful, restful-api, system, terminal, web",153,Web Application
vuejs/vuepress,https://github.com/vuejs/vuepress,JavaScript,4345,20030,14961,20030,"blog-engine, docs-generator, seo, static-site-generator, vue, vuepress",370,Web Application
OWASP/CheatSheetSeries,https://github.com/OWASP/CheatSheetSeries,Python,2840,20014,885221,20014,"application-security, appsec, best-practices, cheatsheets, code, owasp, security",251,Other
alpinejs/alpine,https://github.com/alpinejs/alpine,HTML,885,20008,6561,20008,,196,Other
sirupsen/logrus,https://github.com/sirupsen/logrus,Go,2098,20005,998,20005,"go, logging, logrus",286,Other
ReactiveCocoa/ReactiveCocoa,https://github.com/ReactiveCocoa/ReactiveCocoa,Swift,3566,19988,17115,19988,"reactivecocoa, reactiveswift, swift",261,Web Application
docsifyjs/docsify,https://github.com/docsifyjs/docsify,JavaScript,4853,19984,22365,19984,"doc, docs, docsify, documentation, documentation-tool, github-pages, markdown, vue",174,Web Application
babysor/MockingBird,https://github.com/babysor/MockingBird,JavaScript,2778,19976,127773,19976,"ai, deep-learning, pytorch, speech",20,AI
petkaantonov/bluebird,https://github.com/petkaantonov/bluebird,JavaScript,2412,19957,15124,19957,,235,Other
Kong/insomnia,https://github.com/Kong/insomnia,JavaScript,1203,19946,82682,19946,"api, api-client, api-design, curl, electron-app, graphql, grpc, http-client, rest-api",234,Web Application
dotnet-architecture/eShopOnContainers,https://github.com/dotnet-architecture/eShopOnContainers,C#,8527,19934,654446,19934,"ddd, ddd-patterns, docker, microservices, netcore, spa, windowscontainers, xamarin",190,Other
viatsko/awesome-vscode,https://github.com/viatsko/awesome-vscode,JavaScript,1081,19906,10786,19906,"awesome, awesome-list, list, visual-studio, visual-studio-code, visual-studio-code-extension, visual-studio-code-theme, visualstudio, vscode, vscode-extension, vscode-theme",189,Other
JohnCoates/Aerial,https://github.com/JohnCoates/Aerial,Swift,1019,19899,19753,19899,,55,Other
BradLarson/GPUImage,https://github.com/BradLarson/GPUImage,Objective-C,4617,19899,44862,19899,,161,Other
apache/incubator-mxnet,https://github.com/apache/incubator-mxnet,C++,6892,19884,97870,19884,mxnet,974,Other
elixir-lang/elixir,https://github.com/elixir-lang/elixir,Elixir,2842,19881,53395,19881,,1266,Other
jaredhanson/passport,https://github.com/jaredhanson/passport,JavaScript,1160,19866,554,19866,"express, nodejs, oauth, oauth2, openid, openid-connect, passport, saml",38,Other
ruanyf/es6tutorial,https://github.com/ruanyf/es6tutorial,JavaScript,8666,19847,5618,19847,,219,Other
vercel/pkg,https://github.com/vercel/pkg,JavaScript,854,19836,41381,19836,"binaries, cli, compiler, nodejs",59,Other
coreybutler/nvm-windows,https://github.com/coreybutler/nvm-windows,Go,2117,19833,5433,19833,"go, management, node, nodejs, nvm, switch, version, version-manager, versioning, windows",66,Other
enzymejs/enzyme,https://github.com/enzymejs/enzyme,JavaScript,2103,19827,7733,19827,"assertion-library, assertions, ava, chai, enzyme, jest, mocha, react, react-components, test, test-runner, test-runners, testing, traversal",397,Web Application
facebookarchive/pop,https://github.com/facebookarchive/pop,Objective-C++,2922,19823,646,19823,,68,Other
yewstack/yew,https://github.com/yewstack/yew,Rust,985,19794,8019,19794,"asmjs, concurrency, elm, emscripten, gui, hacktoberfest, jsx, multithreading, rust, wasm, web, web-framework, webworkers",295,"Framework, Web Application"
numpy/numpy,https://github.com/numpy/numpy,Python,6631,19786,106170,19786,"numpy, python",1406,Other
uglide/RedisDesktopManager,https://github.com/uglide/RedisDesktopManager,C++,3093,19785,78537,19785,"database-gui, redis, redis-gui, redis-gui-client",79,Other
sebastianruder/NLP-progress,https://github.com/sebastianruder/NLP-progress,Python,3388,19783,1528,19783,"dialogue, machine-learning, machine-translation, named-entity-recognition, natural-language-processing, nlp-tasks",291,AI
necolas/react-native-web,https://github.com/necolas/react-native-web,JavaScript,1662,19778,51548,19778,"css-in-js, gui-framework, react, react-components, react-native, react-native-web",159,"Framework, Web Application"
onevcat/Kingfisher,https://github.com/onevcat/Kingfisher,Swift,2264,19760,5477,19760,"cache, filters, image, image-processor, ios, kingfisher, macos, swift, xcode",198,Mobile App
goldfire/howler.js,https://github.com/goldfire/howler.js,JavaScript,2026,19755,32182,19755,"audio, audio-library, howler, html5-audio, javascript, playback, volume, web-audio",111,Web Application
SamyPesse/How-to-Make-a-Computer-Operating-System,https://github.com/SamyPesse/How-to-Make-a-Computer-Operating-System,C,3369,19744,5986,19744,,40,Other
withastro/snowpack,https://github.com/withastro/snowpack,JavaScript,989,19735,83687,19735,,411,Other
libgdx/libgdx,https://github.com/libgdx/libgdx,Java,6274,19715,1100634,19715,"2d, 3d, android, cross-platform, framework, game, html5, ios, java, libgdx, linux, macosx, windows",658,"Framework, Mobile App, Web Application"
ageron/handson-ml2,https://github.com/ageron/handson-ml2,Jupyter Notebook,9707,19685,150641,19685,,74,Other
Reactive-Extensions/RxJS,https://github.com/Reactive-Extensions/RxJS,JavaScript,2222,19645,67978,19645,,296,Other
highlightjs/highlight.js,https://github.com/highlightjs/highlight.js,JavaScript,3298,19630,15047,19630,"highlighting, javascript, language-grammars, syntax-highlighter, syntax-highlighting",658,Other
homebridge/homebridge,https://github.com/homebridge/homebridge,TypeScript,1884,19629,3961,19629,"hap, homebridge, homekit, homekit-accessory-protocol, homekit-api, homekit-bridge, siri",116,Web Application
avajs/ava,https://github.com/avajs/ava,JavaScript,1419,19625,12853,19625,"assert, async, async-functions, ava, babel, cli, cli-app, concurrency, hacktoberfest, javascript, node, nodejs, performance, tap, tdd, test-framework, test-runner, testing, unicorns, unit-testing",298,"Framework, Web Application"
ruby/ruby,https://github.com/ruby/ruby,Ruby,5816,18917,277120,18917,"c, language, object-oriented, ruby, ruby-language",518,Other
ReactiveX/RxAndroid,https://github.com/ReactiveX/RxAndroid,Java,3004,19598,970,19598,,78,Other
tipsy/profile-summary-for-github,https://github.com/tipsy/profile-summary-for-github,Vue,482,19529,3258,19529,"github-api, javalin, kotlin, webapp",10,Web Application
michalsnik/aos,https://github.com/michalsnik/aos,JavaScript,2125,19524,1636,19524,,22,Other
Seldaek/monolog,https://github.com/Seldaek/monolog,PHP,1796,19502,3571,19502,"hacktoberfest, logger, logging, php, psr-3",462,Other
railsware/upterm,https://github.com/railsware/upterm,TypeScript,660,19420,7811,19420,"console, electron, pty, react, shell, terminal, terminal-emulators, terminals, tty, typescript",72,Web Application
Pierian-Data/Complete-Python-3-Bootcamp,https://github.com/Pierian-Data/Complete-Python-3-Bootcamp,Jupyter Notebook,66948,19389,25196,19389,,4,Other
ray-project/ray,https://github.com/ray-project/ray,Python,3324,19377,165371,19377,"automl, data-science, deep-learning, deployment, distributed, hyperparameter-optimization, hyperparameter-search, java, machine-learning, model-selection, optimization, parallel, python, ray, reinforcement-learning, rllib, serving",636,AI
ryanhanwu/How-To-Ask-Questions-The-Smart-Way,https://github.com/ryanhanwu/How-To-Ask-Questions-The-Smart-Way,JavaScript,4568,19377,803,19377,"rtfm, stfw, translation",45,Other
DrKLO/Telegram,https://github.com/DrKLO/Telegram,Java,6713,19362,335251,19362,telegram,18,Other
jhipster/generator-jhipster,https://github.com/jhipster/generator-jhipster,JavaScript,3791,19350,108374,19350,"angular, cloud, docker, generator, hacktoberfest, java, jhipster, kubernetes, react, spring-boot, webpack, yeoman-generator",880,Web Application
notable/notable,https://github.com/notable/notable,TypeScript,973,19326,8943,19326,"cross-platform, electron, linux, mac, markdown, note, react, windows",21,Web Application
k3s-io/k3s,https://github.com/k3s-io/k3s,Go,1702,19322,572552,19322,"k8s, kubernetes",159,Other
photoprism/photoprism,https://github.com/photoprism/photoprism,Go,1053,19306,90427,19306,"ai, golang, google-photos, machine-learning, photography, private-cloud, self-hosted, tensorflow",99,AI
parse-community/parse-server,https://github.com/parse-community/parse-server,JavaScript,4619,19302,28970,19302,"baas, backend, file-storage, graphql, graphql-api, graphql-relay, graphql-server, hacktoberfest, mbaas, mongodb, nodejs, notifications, object-storage, parse-platform, parse-server, postgres, relay, rest-api",313,Web Application
yuzu-emu/yuzu,https://github.com/yuzu-emu/yuzu,C++,1615,19278,70085,19278,"c-plus-plus, cpp, emulation, emulator, switch",289,Other
microsoft/cascadia-code,https://github.com/microsoft/cascadia-code,Python,647,19263,18542,19263,,15,Other
youzan/vant,https://github.com/youzan/vant,TypeScript,9218,19239,189503,19239,"components, mobile, ui-kit, ui-library, vant, vue, vue3",233,Web Application
validatorjs/validator.js,https://github.com/validatorjs/validator.js,JavaScript,1887,19213,5226,19213,"hacktoberfest, input, javascript, node, sanitization, sanitize, validate, validation, validations, validator",422,Other
bitcoinbook/bitcoinbook,https://github.com/bitcoinbook/bitcoinbook,AsciiDoc,5108,19212,48491,19212,,206,Other
qishibo/AnotherRedisDesktopManager,https://github.com/qishibo/AnotherRedisDesktopManager,JavaScript,1881,19212,6178,19212,"redis-client, redis-cluster, redis-desktop-manager, redis-gui, redis-sentinel, redis-ssh-ssl",24,Other
zhaoolee/ChromeAppHeroes,https://github.com/zhaoolee/ChromeAppHeroes,JavaScript,2157,19208,783403,19208,,5,Other
afollestad/material-dialogs,https://github.com/afollestad/material-dialogs,Kotlin,3150,19183,265793,19183,"alert, android, androidx, bottomsheets, dialogs, kotlin, material-design",110,Mobile App
v8/v8,https://github.com/v8/v8,C++,3594,19183,1300193,19183,"compiler, interpreter, javascript, javascript-engine, virtual-machine",897,Other
PaddlePaddle/PaddleOCR,https://github.com/PaddlePaddle/PaddleOCR,Python,4014,19164,266844,19164,"chineseocr, crnn, db, ocr, ocrlite",90,Other
sudheerj/reactjs-interview-questions,https://github.com/sudheerj/reactjs-interview-questions,JavaScript,4588,19152,1847,19152,"interview-preparation, interview-questions, javascript, javascript-applications, javascript-framework, javascript-interview-questions, react, react-interview-questions, react-native, react-router, react16, reactjs, redux",73,"Framework, Web Application"
js-cookie/js-cookie,https://github.com/js-cookie/js-cookie,JavaScript,2027,19143,693,19143,"cookie, javascript",58,Other
tsenart/vegeta,https://github.com/tsenart/vegeta,Go,1199,19141,1748,19141,"benchmarking, go, http, load-testing",60,Other
mozilla/DeepSpeech,https://github.com/mozilla/DeepSpeech,C++,3433,19125,50672,19125,"deep-learning, deepspeech, embedded, machine-learning, neural-networks, offline, on-device, speech-recognition, speech-to-text, tensorflow",162,AI
electron-react-boilerplate/electron-react-boilerplate,https://github.com/electron-react-boilerplate/electron-react-boilerplate,TypeScript,3208,19114,15001,19114,"babel, boilerplate, electron, eslint, javascript, react, typescript, webpack",124,Web Application
segmentio/nightmare,https://github.com/segmentio/nightmare,JavaScript,1155,19114,2627,19114,"browser, chrome, electron, headless-chrome, phantomjs",129,Web Application
felixrieseberg/windows95,https://github.com/felixrieseberg/windows95,TypeScript,1163,19102,2873,19102,,14,Other
statelyai/xstate,https://github.com/statelyai/xstate,TypeScript,894,19099,78626,19099,"hacktoberfest, interpreter, orchestration, scxml, state, state-machine, state-management, statechart, visualizer, workflow",285,Other
envoyproxy/envoy,https://github.com/envoyproxy/envoy,C++,3570,19087,138009,19087,"cars, cats, cats-over-dogs, cncf, corgis, more-cats, nanoservices, rocket-ships",932,Other
marmelab/react-admin,https://github.com/marmelab/react-admin,TypeScript,4212,19053,191070,19053,"admin, admin-dashboard, admin-on-rest, admin-ui, frontend-framework, graphql, material-ui, react, react-admin, reactjs, rest, single-page-app",512,"Framework, Web Application"
xi-editor/xi-editor,https://github.com/xi-editor/xi-editor,Rust,699,19026,9553,19026,,166,Other
libuv/libuv,https://github.com/libuv/libuv,C,3064,19014,16923,19014,"asynchronous, deep-io, io, networking, unicorns, unix, velociraptors, windows",501,Other
neoclide/coc.nvim,https://github.com/neoclide/coc.nvim,TypeScript,763,19006,37718,19006,"autocompletion, language-client, lsp, neovim-plugin, nvim, vim, vim-plugin",204,Other
deezer/spleeter,https://github.com/deezer/spleeter,Python,2082,19002,9483,19002,"audio-processing, bass, deep-learning, deezer, drums, model, pretrained-models, python, tensorflow, vocals",19,AI
benweet/stackedit,https://github.com/benweet/stackedit,JavaScript,2592,18984,37337,18984,"blogger, couchdb, dropbox, editor, gist, github, gitlab, google-drive, javascript, markdown, offline, stackedit, wordpress, zendesk",10,Other
google/ExoPlayer,https://github.com/google/ExoPlayer,Java,5586,18982,162793,18982,"android, exoplayer, java, mediaplayer",280,Mobile App
Homebrew/homebrew-cask,https://github.com/Homebrew/homebrew-cask,Ruby,9668,18959,299683,18959,"cask, hacktoberfest, homebrew",9501,Other
verekia/js-stack-from-scratch,https://github.com/verekia/js-stack-from-scratch,JavaScript,1930,18940,1807,18940,"bootstrap, eslint, flow, heroku, immutablejs, javascript, jest, jss, nodemon, pm2, react, react-router, redux, server-side-rendering, sinon, socket-io, stack, tutorial, webpack, yarn",40,Web Application
trekhleb/homemade-machine-learning,https://github.com/trekhleb/homemade-machine-learning,Jupyter Notebook,3551,18934,14824,18934,"algorithm, jupyter, jupyter-notebook, machine-learning, machine-learning-algorithms, machinelearning, python",2,AI
ruby/ruby,https://github.com/ruby/ruby,Ruby,5816,18917,277120,18917,"c, language, object-oriented, ruby, ruby-language",518,Other
zyedidia/micro,https://github.com/zyedidia/micro,Go,980,18915,12644,18915,"command-line, cross-platform, editor, go, golang, micro, terminal, text-editor",244,Other
drduh/macOS-Security-and-Privacy-Guide,https://github.com/drduh/macOS-Security-and-Privacy-Guide,Python,1356,18885,1717,18885,"apple, disk-encryption, dnscrypt-proxy, macbook-configuration, macbook-security, macos, macos-security, macos-setup, osx, privacy, security",87,Other
