Project Name,URL,Language,Forks,Watchers,Size Byte,Stars,Topics,Contributors,Type
hashicorp/consul,https://github.com/hashicorp/consul,Go,4003,24368,373485,24368,"api-gateway, consul, ecs, kubernetes, service-discovery, service-mesh, vault",887,Web Application
Dreamacro/clash,https://github.com/Dreamacro/clash,Go,3467,24366,1385,24366,"clash, golang, rule-based, tunnel",75,Other
odoo/odoo,https://github.com/odoo/odoo,JavaScript,15787,24317,4245023,24317,"apps, business, erp, management, odoo, odoo-apps, python",2065,Other
0xAX/linux-insides,https://github.com/0xAX/linux-insides,Python,2841,24247,16127,24247,"linux, linux-insides, linux-kernel",313,Other
fengdu78/Coursera-ML-AndrewNg-Notes,https://github.com/fengdu78/Coursera-ML-AndrewNg-Notes,HTML,9274,24229,658843,24229,"coursera, machine-learning",7,AI
JedWatson/react-select,https://github.com/JedWatson/react-select,TypeScript,3863,24212,19506,24212,,481,Other
GoogleChrome/lighthouse,https://github.com/GoogleChrome/lighthouse,JavaScript,8444,24195,118860,24195,"audit, best-practices, chrome-devtools, developer-tools, performance-analysis, performance-metrics, pwa, web",306,Web Application
CamDavidsonPilon/Probabilistic-Programming-and-Bayesian-Methods-for-Hackers,https://github.com/CamDavidsonPilon/Probabilistic-Programming-and-Bayesian-Methods-for-Hackers,Jupyter Notebook,7547,24153,147547,24153,"bayesian-methods, data-science, jupyter-notebook, mathematical-analysis, pymc, statistics",156,Other
alibaba/fastjson,https://github.com/alibaba/fastjson,Java,6389,24149,15490,24149,"android, best-performance, deserialization, fastjson, java, json, json-parser, json-serialization, json-serializer, serialization",206,Mobile App
ajaxorg/ace,https://github.com/ajaxorg/ace,JavaScript,5131,24140,40231,24140,,489,Other
topjohnwu/Magisk,https://github.com/topjohnwu/Magisk,C++,5838,24112,55835,24112,,258,Other
ageron/handson-ml,https://github.com/ageron/handson-ml,Jupyter Notebook,12705,24084,108340,24084,"deep-learning, distributed, jupyter-notebook, machine-learning, ml, neural-network, python, scikit-learn, tensorflow",39,AI
bannedbook/fanqiang,https://github.com/bannedbook/fanqiang,Kotlin,5445,24072,711064,24072,"brook, daze, fanqiang, goflyway, lightsocks, proxy, psiphon, shadowsocks, ssr, trojan, v2ray",2,Other
Anduin2017/HowToCook,https://github.com/Anduin2017/HowToCook,JavaScript,3063,24049,91987,24049,"chinese, cookbook, cooking, dishes, recipes",201,Other
SDWebImage/SDWebImage,https://github.com/SDWebImage/SDWebImage,Objective-C,5786,24016,14735,24016,"cache, carthage, cocoapods, gif, image, ios, jpeg, macos, objective-c, png, sdwebimage, swift, watchos, webp",314,"Mobile App, Web Application"
rstacruz/nprogress,https://github.com/rstacruz/nprogress,JavaScript,1828,23994,722,23994,,34,Other
qiurunze123/miaosha,https://github.com/qiurunze123/miaosha,Java,6205,23976,65706,23976,,11,Other
goabstract/Awesome-Design-Tools,https://github.com/goabstract/Awesome-Design-Tools,JavaScript,1817,23962,19313,23962,"animations, awesome, awesome-list, design, design-systems, design-tools, font-awesome, ui-design",236,Other
Automattic/mongoose,https://github.com/Automattic/mongoose,JavaScript,3383,23955,79207,23955,,769,Other
tmux/tmux,https://github.com/tmux/tmux,C,1669,23942,15713,23942,,38,Other
iview/iview,https://github.com/iview/iview,Vue,4226,23929,33382,23929,"components, css, design-systems, frontend, iview, javascript, ui-design, ui-kit, vue, vue-components",189,Web Application
microsoft/calculator,https://github.com/microsoft/calculator,C++,4342,23889,35460,23889,"cpp, csharp, uwp, windows, windows-10, xaml",89,Other
cockroachdb/cockroach,https://github.com/cockroachdb/cockroach,Go,3057,23854,1807886,23854,"cockroachdb, database, distributed-database, go, hacktoberfest, sql",639,Other
greenrobot/EventBus,https://github.com/greenrobot/EventBus,Java,4655,23852,1734,23852,,26,Other
curl/curl,https://github.com/curl/curl,C,4932,23837,83708,23837,"c, client, curl, ftp, gopher, hacktoberfest, http, https, imaps, ldap, libcurl, library, mqtt, pop3, scp, sftp, transfer-data, transferring-data, user-agent",1043,Other
parallax/jsPDF,https://github.com/parallax/jsPDF,JavaScript,4233,23829,106341,23829,hacktoberfest,202,Other
jobbole/awesome-python-cn,https://github.com/jobbole/awesome-python-cn,Makefile,7347,23782,1584,23782,python,36,Other
ycm-core/YouCompleteMe,https://github.com/ycm-core/YouCompleteMe,Python,2755,23730,37277,23730,"code-analysis, code-completion, semantic-engine, vim",177,Other
PKUanonym/REKCARC-TSC-UHT,https://github.com/PKUanonym/REKCARC-TSC-UHT,HTML,6203,22817,4331183,22817,"computer-science, course, course-assignment, course-project, tsinghua-university",48,Other
ianstormtaylor/slate,https://github.com/ianstormtaylor/slate,TypeScript,2653,23700,19172,23700,"browser, editor, framework, javascript, react, rich-text, slate, text-editor",467,"Framework, Web Application"
remy/nodemon,https://github.com/remy/nodemon,JavaScript,1570,23680,2557,23680,"hacktoberfest, node, nodemon, watch",158,Other
YMFE/yapi,https://github.com/YMFE/yapi,JavaScript,4160,23656,233299,23656,"api, api-management, api-manager, api-test",114,Web Application
pcottle/learnGitBranching,https://github.com/pcottle/learnGitBranching,JavaScript,5144,23605,35571,23605,,261,Other
halfrost/LeetCode-Go,https://github.com/halfrost/LeetCode-Go,Go,4352,23604,19350,23604,"acm-icpc, algo, algorithm, algorithm-competitions, algorithms, algorithms-and-data-structures, dynamic-programming, facebook, go, golang, interview-questions, leetcode, leetcode-go, leetcode-golang, leetcode-solutions, math, pattern",44,Other
terryum/awesome-deep-learning-papers,https://github.com/terryum/awesome-deep-learning-papers,TeX,4475,23564,147,23564,"deep-learning, deep-neural-networks, machine-learning",36,AI
ccxt/ccxt,https://github.com/ccxt/ccxt,JavaScript,5788,23489,1613239,23489,"altcoin, api, arbitrage, bitcoin, bot, btc, crypto, cryptocurrency, e-commerce, eth, ethereum, exchange, invest, library, market-data, merchant, strategy, trade, trading",626,Web Application
akveo/ngx-admin,https://github.com/akveo/ngx-admin,TypeScript,7498,23454,66831,23454,"admin, admin-dashboard, admin-template, admin-ui, angular-dashboard-template, angular10, angular2, angular9, bootstrap4, dashboard, framework, material-theme, ng2, ng2-admin, ngx-admin, responsive, sass, theme, typescript, webpack",36,"Framework, Web Application"
hashicorp/vault,https://github.com/hashicorp/vault,Go,3257,23454,194777,23454,"go, secrets, vault",1160,Other
CMU-Perceptual-Computing-Lab/openpose,https://github.com/CMU-Perceptual-Computing-Lab/openpose,C++,6952,23448,86330,23448,"caffe, computer-vision, cpp, cvpr-2017, deep-learning, face, foot-estimation, hand-estimation, human-behavior-understanding, human-pose, human-pose-estimation, keypoint-detection, keypoints, machine-learning, multi-person, opencv, openpose, pose, pose-estimation, real-time",94,AI
lenve/vhr,https://github.com/lenve/vhr,Java,9657,23437,9233,23437,,2,Other
hashicorp/vagrant,https://github.com/hashicorp/vagrant,Ruby,4228,23431,75840,23431,"automation, hacktoberfest, ruby, vagrant, virtualization",1217,Other
facebookresearch/fastText,https://github.com/facebookresearch/fastText,HTML,4451,23425,8456,23425,,59,Other
kubernetes/minikube,https://github.com/kubernetes/minikube,Go,3991,23402,169366,23402,"cluster, cncf, containers, go, kubernetes, minikube",762,Other
cmderdev/cmder,https://github.com/cmderdev/cmder,C++,1922,23354,2851,23354,"c-plus-plus, cmder, color-scheme, conemu, mintty, portable, powershell, ssh-agent",145,Other
ggreer/the_silver_searcher,https://github.com/ggreer/the_silver_searcher,C,1327,23326,2426,23326,"ag, c, command-line-tool, pcre, search-in-text, silver-searcher",243,Other
dwmkerr/hacker-laws,https://github.com/dwmkerr/hacker-laws,Shell,1370,23312,3014,23312,"coding, computerscience, laws, principles",83,Other
scwang90/SmartRefreshLayout,https://github.com/scwang90/SmartRefreshLayout,Java,4785,23311,273220,23311,"android, android-ui, footer, header, overscroll, pull-to-refresh, pulltorefresh, refreshlayout",7,Mobile App
bvaughn/react-virtualized,https://github.com/bvaughn/react-virtualized,JavaScript,2918,23300,48176,23300,"grid, list, listview, performance, react, react-components, tabular-data, virtualization, windowing",214,Web Application
nagadomi/waifu2x,https://github.com/nagadomi/waifu2x,Lua,2497,23273,709480,23273,"super-resolution, torch, waifu2x",39,Other
CodeHubApp/CodeHub,https://github.com/CodeHubApp/CodeHub,C#,643,23246,75626,23246,"c-sharp, codehub, github, reactiveui",10,Web Application
OAI/OpenAPI-Specification,https://github.com/OAI/OpenAPI-Specification,JavaScript,8113,23223,3233,23223,"apis, oas, openapi, openapi-specification, rest, webapi",201,Web Application
yunjey/pytorch-tutorial,https://github.com/yunjey/pytorch-tutorial,Python,7102,23148,13110,23148,"deep-learning, neural-networks, pytorch, pytorch-tutorial",27,AI
influxdata/influxdb,https://github.com/influxdata/influxdb,Go,3128,23099,162434,23099,"database, go, influxdb, metrics, monitoring, react, time-series",556,Web Application
powerline/fonts,https://github.com/powerline/fonts,Shell,3112,22997,20700,22997,,68,Other
Binaryify/NeteaseCloudMusicApi,https://github.com/Binaryify/NeteaseCloudMusicApi,JavaScript,7295,22996,14635,22996,"api, apis, cloudmusic, javascript, neteasecloud, nodejs",69,Web Application
alibaba/flutter-go,https://github.com/alibaba/flutter-go,Dart,3701,22967,117708,22967,"dart, flutter, flutter-demo, flutter-doc",29,Other
SeleniumHQ/selenium,https://github.com/SeleniumHQ/selenium,Java,6804,22911,1941263,22911,"dotnet, java, javascript, python, ruby, selenium, webdriver",720,Web Application
encode/django-rest-framework,https://github.com/encode/django-rest-framework,Python,6049,22901,49358,22901,"api, django, python, rest",1256,Web Application
hammerjs/hammer.js,https://github.com/hammerjs/hammer.js,JavaScript,2662,22891,10221,22891,,100,Other
VundleVim/Vundle.vim,https://github.com/VundleVim/Vundle.vim,Vim script,2541,22877,935,22877,,66,Other
starship/starship,https://github.com/starship/starship,Rust,957,22848,21913,22848,"bash, fish, fish-prompt, fish-theme, hacktoberfest, oh-my-zsh, powershell, rust, shell-prompt, starship, zsh, zsh-prompt, zsh-theme",344,Other
wuyouzhuguli/SpringAll,https://github.com/wuyouzhuguli/SpringAll,Java,6890,22843,1090,22843,"learning, shiro, spring-boot, spring-boot-learning, spring-cloud, spring-security, springboot",3,Other
gitlabhq/gitlabhq,https://github.com/gitlabhq/gitlabhq,Ruby,5685,22836,1145807,22836,"gitlab, rails, ruby",2998,Other
PKUanonym/REKCARC-TSC-UHT,https://github.com/PKUanonym/REKCARC-TSC-UHT,HTML,6203,22817,4331183,22817,"computer-science, course, course-assignment, course-project, tsinghua-university",48,Other
huihut/interview,https://github.com/huihut/interview,C++,6321,22773,6022,22773,"algorithm, c, cpp, data-structures, database, interview, interview-practice, interview-preparation, interview-questions, interviews, leetcode, operating-system, stl",25,Other
iamadamdev/bypass-paywalls-chrome,https://github.com/iamadamdev/bypass-paywalls-chrome,JavaScript,1655,22744,1403,22744,"bypass, bypass-paywalls, chrome, chrome-extension, chrome-extensions, firefox, firefox-addon, firefox-extension, paywall",53,Other
alibaba/easyexcel,https://github.com/alibaba/easyexcel,Java,6095,22737,26088,22737,"excel, java, jxl, oom, poi, xls, xlsx",45,Other
pypa/pipenv,https://github.com/pypa/pipenv,Python,1717,22731,247881,22731,"packaging, pip, pipfile, python, virtualenv",411,Other
ultralytics/yolov5,https://github.com/ultralytics/yolov5,Python,8109,22716,11404,22716,"coreml, deep-learning, ios, machine-learning, ml, object-detection, onnx, pytorch, tflite, yolo, yolov3, yolov4, yolov5",213,"AI, Mobile App"
StreisandEffect/streisand,https://github.com/StreisandEffect/streisand,Shell,2015,22658,4116,22658,"ansible, anyconnect, censorship, openconnect, openvpn, shadowsocks, ssh, streisand, stunnel, tor, vpn, wireguard",144,Other
CymChad/BaseRecyclerViewAdapterHelper,https://github.com/CymChad/BaseRecyclerViewAdapterHelper,Java,4845,22640,64860,22640,"android, android-library, recyclerview, recyclerview-adapter, recyclerview-item-animation",51,Mobile App
sqlmapproject/sqlmap,https://github.com/sqlmapproject/sqlmap,Python,4707,22590,83284,22590,"database, detection, exploitation, pentesting, python, sql-injection, sqlmap, takeover, vulnerability-scanner",113,Other
donnemartin/data-science-ipython-notebooks,https://github.com/donnemartin/data-science-ipython-notebooks,Python,6995,22529,49025,22529,"aws, big-data, caffe, data-science, deep-learning, hadoop, kaggle, keras, machine-learning, mapreduce, matplotlib, numpy, pandas, python, scikit-learn, scipy, spark, tensorflow, theano",13,AI
explosion/spaCy,https://github.com/explosion/spaCy,Python,3729,22526,185803,22526,"ai, artificial-intelligence, cython, data-science, deep-learning, entity-linking, machine-learning, named-entity-recognition, natural-language-processing, neural-network, neural-networks, nlp, nlp-library, python, spacy, text-classification, tokenization",658,AI
cfenollosa/os-tutorial,https://github.com/cfenollosa/os-tutorial,C,2790,22519,154,22519,,13,Other
angular/components,https://github.com/angular/components,TypeScript,6035,22510,75811,22510,"angular, angular-components, material, material-design",621,Web Application
airbnb/lottie-ios,https://github.com/airbnb/lottie-ios,Swift,3310,22509,79781,22509,"animation, bodymovin, custom-transitions, ios, ios-animation, ios-transition, keyframes, transition-animation",180,Mobile App
pmndrs/react-spring,https://github.com/pmndrs/react-spring,TypeScript,983,22502,386913,22502,"animation-library, react, react-spring, spring-physics, springs",150,Web Application
rust-lang/rustlings,https://github.com/rust-lang/rustlings,Rust,3513,22498,1306,22498,"beginner-friendly, rust, rustlings",222,Other
go-kit/kit,https://github.com/go-kit/kit,Go,2270,22480,7463,22480,"go, golang, metallica, microservices",217,Other
meilisearch/meilisearch,https://github.com/meilisearch/meilisearch,Rust,786,22478,35321,22478,"database, entreprise-search, highlighting, instant, rust, search-engine, site-search, synonyms, typo-tolerance",79,Other
nocodb/nocodb,https://github.com/nocodb/nocodb,Vue,1360,22466,60621,22466,"admin-dashboard, admin-ui, airtable, airtable-alternative, automatic-api, hacktoberfest, hacktoberfest2021, low-code, mariadb, mysql, no-code, no-code-database, postgresql, rest-api, restful-api, spreadsheet, sqlite, sqlserver, swagger",77,Web Application
dokku/dokku,https://github.com/dokku/dokku,Shell,1718,22461,12046,22461,"buildpack, containers, devops, docker, dokku, heroku, kubernetes, nomad, paas",466,Other
Netflix/Hystrix,https://github.com/Netflix/Hystrix,Java,4559,22430,9784,22430,,147,Other
ClickHouse/ClickHouse,https://github.com/ClickHouse/ClickHouse,C++,4435,22424,588299,22424,"analytics, big-data, clickhouse, dbms, distributed-database, hacktoberfest, mpp, olap, sql",1301,Other
balena-io/etcher,https://github.com/balena-io/etcher,TypeScript,1611,22402,94682,22402,"cross-platform, etcher, sd-cards, usb-drives",78,Other
hollischuang/toBeTopJavaer,https://github.com/hollischuang/toBeTopJavaer,Java,5062,22385,7547,22385,"design-patterns, java, jvm, mysql, programmer, spring",43,Other
immerjs/immer,https://github.com/immerjs/immer,JavaScript,704,22319,8643,22319,"immutable, immutables, reducer, redux, state-tree",156,Other
fastify/fastify,https://github.com/fastify/fastify,JavaScript,1653,22317,5724,22317,"nodejs, performance, speed, webframework",480,"Framework, Web Application"
doczjs/docz,https://github.com/doczjs/docz,TypeScript,1442,22276,13012,22276,"design-system, docs, documentation, docz, gatsby, js, mdx, react, theme, ui, zero-configuration",134,Web Application
dmlc/xgboost,https://github.com/dmlc/xgboost,C++,8331,22270,22752,22270,"distributed-systems, gbdt, gbm, gbrt, machine-learning, xgboost",549,AI
pjreddie/darknet,https://github.com/pjreddie/darknet,C,19448,22268,6518,22268,,10,Other
heartcombo/devise,https://github.com/heartcombo/devise,Ruby,5376,22253,5558,22253,"authentication, devise, rails, ruby",681,Other
tj/commander.js,https://github.com/tj/commander.js,JavaScript,1589,22236,2927,22236,,167,Other
alibaba/canal,https://github.com/alibaba/canal,Java,6587,22214,18645,22214,,174,Other
pure-css/pure,https://github.com/pure-css/pure,JavaScript,2447,22211,4840,22211,"css, html, pure",68,Web Application
balderdashy/sails,https://github.com/balderdashy/sails,JavaScript,1948,22183,13165,22183,,280,Other
emberjs/ember.js,https://github.com/emberjs/ember.js,JavaScript,4271,22156,77058,22156,"ember, hacktoberfest, javascript, javascript-framework",1081,"Framework, Web Application"
google-research/google-research,https://github.com/google-research/google-research,Jupyter Notebook,5277,22134,335608,22134,"ai, machine-learning, research",509,AI
harvesthq/chosen,https://github.com/harvesthq/chosen,HTML,4204,22112,3045,22112,"deprecated, not-maintained",124,Other
signalapp/Signal-Android,https://github.com/signalapp/Signal-Android,Java,5361,22086,557585,22086,,290,Other
redux-saga/redux-saga,https://github.com/redux-saga/redux-saga,JavaScript,2006,22083,11202,22083,"effects, middleware, redux, redux-saga, sagas",345,Other
syl20bnr/spacemacs,https://github.com/syl20bnr/spacemacs,Emacs Lisp,4941,22076,57060,22076,"community-driven, configuration, emacs, spacemacs, vim",1427,Other
react-native-elements/react-native-elements,https://github.com/react-native-elements/react-native-elements,TypeScript,4365,22064,86476,22064,"android, hacktoberfest, ios, mobile-app, react, react-native, ui, ui-components",361,"Mobile App, Web Application"
littlecodersh/ItChat,https://github.com/littlecodersh/ItChat,Python,5223,22041,955,22041,"api, itchat, robot, wechat",16,Web Application
dromara/hutool,https://github.com/dromara/hutool,Java,6284,22035,41097,22035,"http, hutool, java, json, orm, tool, util",231,Other
mdbootstrap/mdb-ui-kit,https://github.com/mdbootstrap/mdb-ui-kit,JavaScript,3458,22026,47052,22026,"bootstrap, bootstrap-material, bootstrap5, css, framework, html, javascript, material, material-design, material-design-for-bootstrap, uikit",116,"Framework, Web Application"
fastai/fastai,https://github.com/fastai/fastai,Jupyter Notebook,7208,22003,662133,22003,"colab, deep-learning, fastai, gpu, machine-learning, notebooks, python, pytorch",187,AI
nektos/act,https://github.com/nektos/act,Go,574,22002,5654,22002,"ci, devops, github-actions, golang",105,Other
google/python-fire,https://github.com/google/python-fire,Python,1280,22001,6231,22001,"cli, python",46,Other
facebook/rocksdb,https://github.com/facebook/rocksdb,C++,4983,21996,180675,21996,"database, storage-engine",850,Other
vuejs/devtools,https://github.com/vuejs/devtools,TypeScript,3674,21984,14647,21984,,117,Other
mattermost/mattermost-server,https://github.com/mattermost/mattermost-server,Go,5347,21951,540664,21951,"collaboration, golang, hacktoberfest, mattermost, react-native",707,Web Application
emscripten-core/emscripten,https://github.com/emscripten-core/emscripten,C,2766,21940,247842,21940,,715,Other
t4t5/sweetalert,https://github.com/t4t5/sweetalert,TypeScript,2905,21922,5237,21922,"alert, dialog, javascript, modal, popup, sweetalert, ui",69,Other
jamiebuilds/the-super-tiny-compiler,https://github.com/jamiebuilds/the-super-tiny-compiler,JavaScript,2396,21921,41,21921,,6,Other
kataras/iris,https://github.com/kataras/iris,Go,2367,21920,15840,21920,"expressjs, framework, go, golang, iris, laravel, middleware, mvc, performance, router, server, web-framework",97,"Framework, Web Application"
jesseduffield/lazydocker,https://github.com/jesseduffield/lazydocker,Go,822,21861,23321,21861,,49,Other
ovity/octotree,https://github.com/ovity/octotree,JavaScript,1850,21853,82923,21853,"browser-extension, chrome, code-files, code-review, edge, firefox, github, opera, pull-request-review, safari",69,Web Application
beurtschipper/Depix,https://github.com/beurtschipper/Depix,Python,2605,21821,820,21821,,10,Other
reduxjs/react-redux,https://github.com/reduxjs/react-redux,TypeScript,3196,21818,6645,21818,"react, redux",268,Web Application
Polymer/polymer,https://github.com/Polymer/polymer,HTML,2027,21761,30218,21761,"polymer, web-components",161,Web Application
labstack/echo,https://github.com/labstack/echo,Go,1925,21754,5896,21754,"echo, go, http2, https, labstack-echo, letsencrypt, micro-framework, microservice, middleware, ssl, web, web-framework, websocket",245,"Framework, Web Application"
ramda/ramda,https://github.com/ramda/ramda,JavaScript,1381,21744,7917,21744,"javascript, ramda",328,Other
seata/seata,https://github.com/seata/seata,Java,7429,21736,10633,21736,"branch-transactions, data-consistency, distributed-transaction, dtx, fescar, gts, microservice, saga, seata, tcc, tcc-transaction, transaction-manager, xa",240,Other
lovell/sharp,https://github.com/lovell/sharp,JavaScript,1091,21705,48747,21705,"avif, crop, exif, icc, image, image-processing, javascript, jpeg, libvips, nodejs, performance, png, resize, sharp, svg, tiff, webp",161,Web Application
Tencent/wepy,https://github.com/Tencent/wepy,JavaScript,3057,21694,9976,21694,"weapp, wepy",187,Other
matteocrippa/awesome-swift,https://github.com/matteocrippa/awesome-swift,Swift,2934,21681,9106,21681,"awesome, awesome-list, awesome-lists, awesome-swift, ios, linux, list, lists, swift, swift-extensions, swift-framework, swift-language, swift-library",664,"Framework, Mobile App, Web Application"
ReactiveX/RxSwift,https://github.com/ReactiveX/RxSwift,Swift,3894,21670,15990,21670,"functional, ios, observer, reactive, reactivex, rxswift, swift, unidirectional",375,"Mobile App, Web Application"
swagger-api/swagger-ui,https://github.com/swagger-api/swagger-ui,JavaScript,8243,21667,411978,21667,"hacktoberfest, oas, openapi, openapi-specification, openapi3, rest, rest-api, swagger, swagger-api, swagger-js, swagger-ui",503,Web Application
facebook/flow,https://github.com/facebook/flow,OCaml,1839,21665,97888,21665,,896,Other
sickcodes/Docker-OSX,https://github.com/sickcodes/Docker-OSX,Shell,1009,21626,13499,21626,"container, docker, docker-osx, kvm, macos, os, osx, osx-kvm, x, x11",39,Other
coolsnowwolf/lede,https://github.com/coolsnowwolf/lede,C,16504,20126,274389,20126,"lede, lua, openwrt, openwrt-feed, openwrt-package, openwrt-shadowsocksr-libev-full, openwrt-zh-cn",325,Other
github/hub,https://github.com/github/hub,Go,2292,21586,7255,21586,"git, github-api, go, homebrew, pull-request",247,Web Application
android/architecture-components-samples,https://github.com/android/architecture-components-samples,Kotlin,7916,21557,21430,21557,,67,Other
sampotts/plyr,https://github.com/sampotts/plyr,JavaScript,2579,21550,64895,21550,"html5-video, javascript, plyr, vimeo, youtube",181,Web Application
alibaba/nacos,https://github.com/alibaba/nacos,Java,9238,21537,43857,21537,"alibaba, config, configuration-management, distributed-configuration, dns, dubbo, istio, kubernetes, microservices, nacos, service-discovery, service-mesh, spring-cloud",250,Other
MostlyAdequate/mostly-adequate-guide,https://github.com/MostlyAdequate/mostly-adequate-guide,JavaScript,1790,21533,5412,21533,"functional-programming, javascript, reactive-programming, tutorial",183,Web Application
guzzle/guzzle,https://github.com/guzzle/guzzle,PHP,2268,21515,9854,21515,"curl, guzzle, http-client, httpclient, php, psr-7, requests, webservices",398,Web Application
bregman-arie/devops-exercises,https://github.com/bregman-arie/devops-exercises,Python,4536,21514,3305,21514,"ansible, aws, azure, coding, containers, devops, docker, git, interview, interview-questions, kubernetes, linux, openstack, production-engineer, prometheus, python, sql, sre, terraform",81,Other
facebook/folly,https://github.com/facebook/folly,C++,4551,21490,40122,21490,,1102,Other
alibaba/spring-cloud-alibaba,https://github.com/alibaba/spring-cloud-alibaba,Java,6635,21488,7181,21488,"alibaba, alibaba-middleware, alibaba-oss, aliyun, circuit-breaker, cloud-native, distributed-configuration, distributed-messaging, distributed-transaction, dubbo, java, microservices, nacos, rocketmq, service-discovery, service-registry, spring, spring-cloud, spring-cloud-alibaba, spring-cloud-core",139,Other
facebook/draft-js,https://github.com/facebook/draft-js,JavaScript,2552,21447,35690,21447,,317,Other
vapor/vapor,https://github.com/vapor/vapor,Swift,1326,21439,16103,21439,"framework, http, http2, server, server-side-swift, swift, vapor, web-framework",218,"Framework, Web Application"
stedolan/jq,https://github.com/stedolan/jq,C,1267,21439,6900,21439,,141,Other
inconshreveable/ngrok,https://github.com/inconshreveable/ngrok,Go,3960,21427,858,21427,,27,Other
Wox-launcher/Wox,https://github.com/Wox-launcher/Wox,C#,2303,21416,98055,21416,"alfred, launcher, launchy, spotlight, windows, wox",124,Other
vercel/swr,https://github.com/vercel/swr,TypeScript,810,21386,2891,21386,"cache, data, data-fetching, fetch, hook, hooks, nextjs, react, react-native, stale-while-revalidate, suspense, swr, vercel",131,Web Application
tqdm/tqdm,https://github.com/tqdm/tqdm,Python,1089,21338,5913,21338,"cli, closember, console, discord, gui, jupyter, keras, meter, pandas, parallel, progress, progress-bar, progressbar, progressmeter, python, rate, telegram, terminal, time, utilities",107,Other
feathericons/feather,https://github.com/feathericons/feather,JavaScript,1062,21323,16412,21323,"icons, javascript, svg",37,Other
matterport/Mask_RCNN,https://github.com/matterport/Mask_RCNN,Python,10570,21319,122597,21319,"instance-segmentation, keras, mask-rcnn, object-detection, tensorflow",47,Other
apache/kafka,https://github.com/apache/kafka,Java,11194,21296,135070,21296,"kafka, scala",1068,Other
rollup/rollup,https://github.com/rollup/rollup,JavaScript,1112,21294,21530,21294,,302,Other
